{
  "schema_version": 1,
  "project": "WARP",
  "stage": "2P-E-C3-REPEAT",
  "record_type": "binary-audit-gate-03-corrective-repeat-human-decision-real",
  "status": "AUTHORIZED_FOR_SINGLE_GATE",
  "note": "Decisao humana real que autoriza exatamente uma repeticao corretiva do GATE 3, presa ao head autorizador e aos blobs do parser e dos testes.",
  "original_decision_ref": { "path": "client/warp-audit/decisions/binary-audit-gate-03-decision-record-2026-08-03.json" },
  "original_invalidated_evidence_ref": { "path": "client/warp-audit/evidence/binary-audit-gate-03-identity-signature-evidence-2026-08-03.json" },
  "r1_review_ref": { "path": "docs/39-resultado-gate-3-identidade-assinatura-warp.md" },
  "reviewed_parser_ref": { "path": "scripts/inspect-warp-pe-identity.py" },
  "reviewed_parser_test_ref": { "path": "scripts/test-warp-pe-identity.py" },
  "integration_ref": { "pr": 50, "squash_commit": "6ab37b2a7ae65fd6b4fdf184759b345cf9ce4bd6", "base_branch": "dev" },
  "reviewed_parser_commit": "bebe4fe9843e52b45b4d244a0f49f338ec3452d4",
  "reviewed_parser_git_blob_oid": "3442ddfc585b61bba19293ce0980d7addcd7ae5b",
  "reviewed_parser_test_git_blob_oid": "6d7cab1b2ae7ea8514718b7b98f2bd324fb38a41",
  "gate": { "id": 3, "name": "IDENTITY_AND_SIGNATURE" },
  "decider": "BrunoMNoronha",
  "role": "Responsavel tecnico do projeto FaithRO",
  "authority": "Responsavel tecnico e mantenedor do repositorio BrunoMNoronha/FaithRO",
  "channel": "Decisao humana delegada ao consultor tecnico FaithRO nesta conversa",
  "date": "2026-08-03",
  "decision": "AUTHORIZE_CORRECTIVE_REPEAT_GATE_3",
  "justification": "A evidencia original do GATE 3 foi invalidada na revisao R1 e as revisoes R2..R4.1 endureceram o inspetor PE revisavel, a maquina de estados e a ligacao exata da saida. Autoriza-se uma unica repeticao corretiva para reconfirmar a identidade do blob autorizado e determinar estruturalmente a Certificate Table com o parser revisado e versionado, sem executar nem carregar o binario.",
  "authorized_scope": "Exatamente uma rematerializacao temporaria do unico blob WARP autorizado a partir do GitHub oficial, hashing local, execucao apenas do parser Python revisado para leitura estatica de identidade e inspecao estrutural da Certificate Table, e remocao integral do binario.",
  "materialization_scope": {
    "repository_full_name": "Neo-Mind/WARP",
    "repository_visibility": "PUBLIC",
    "expected_branch": "rock_win32",
    "commit_oid": "9b1173e9e4e135c68e150704f01186ab5e763acd",
    "tree_oid": "1aebae06d5c71a145afc35cc72fcf5c210a08758",
    "artifact_path": "win32/WARP.exe",
    "artifact_blob_oid": "c853da42d18dfe090b4e941b435d989311faf3dc",
    "artifact_blob_oid_algorithm": "GIT_OBJECT_ID",
    "artifact_blob_size": 1137152,
    "max_files": 1,
    "network_scope": "GITHUB_OFFICIAL_ONLY"
  },
  "repeat_scope": { "exactly_one_repeat": true, "repeat_index": 1 },
  "precondition": { "gate_2_outcome": "COMPLETED_PASS", "original_evidence_invalidated": true },
  "allowed_methods": [
    "Rematerializar o blob autorizado exclusivamente pela API oficial Git Data do GitHub, buscando por object ID, e decodificar direto para um unico arquivo temporario fora do repositorio",
    "Reconfirmar localmente tamanho, Git blob OID e SHA-256 antes de invocar o parser",
    "Executar somente o parser Python revisado e versionado para leitura estatica da identidade PE e inspecao estrutural da Certificate Table",
    "Remover integralmente o binario temporario em qualquer desfecho"
  ],
  "prohibited_actions": [
    "Executar ou carregar o binario",
    "Analise dinamica, Wine, VM ou sandbox",
    "Rede apos a obtencao, servico externo ou reputacao online",
    "Acesso ao cliente, ao Ragexe ou a VPS",
    "GATE 4, inventario de secoes/imports/exports/strings",
    "Segunda repeticao",
    "Merge do PR #52"
  ],
  "conditions": [
    { "n": 1, "text": "O head autorizador deve ser exatamente bebe4fe9843e52b45b4d244a0f49f338ec3452d4." },
    { "n": 2, "text": "Os blobs do parser (3442ddfc585b61bba19293ce0980d7addcd7ae5b) e dos testes (6d7cab1b2ae7ea8514718b7b98f2bd324fb38a41) devem ser recalculados e conferidos antes e depois." },
    { "n": 3, "text": "Exatamente uma repeticao corretiva e autorizada; repeat_index=1." },
    { "n": 4, "text": "Exatamente um arquivo binario WARP pode ser materializado." },
    { "n": 5, "text": "A unica origem de rede permitida e o GitHub oficial." },
    { "n": 6, "text": "O blob deve ser obtido diretamente pelo Git object ID c853da42d18dfe090b4e941b435d989311faf3dc." },
    { "n": 7, "text": "A materializacao deve ocorrer em diretorio temporario fora do repositorio." },
    { "n": 8, "text": "Devem ser aplicadas permissoes restritas e umask 077 na medida suportada pelo sistema operacional." },
    { "n": 9, "text": "O tamanho deve ser reconfirmado antes de invocar o parser." },
    { "n": 10, "text": "O Git blob OID deve ser reconfirmado antes de invocar o parser." },
    { "n": 11, "text": "O SHA-256 deve ser reconfirmado antes de invocar o parser." },
    { "n": 12, "text": "O parser nao executa nem carrega o PE; apenas le os bytes de forma estatica." },
    { "n": 13, "text": "Nenhum uso de Wine, VM ou sandbox e permitido." },
    { "n": 14, "text": "Nenhum acesso de rede e permitido apos a obtencao do blob." },
    { "n": 15, "text": "Nenhum servico externo ou validacao de reputacao online e permitido." },
    { "n": 16, "text": "Nenhum acesso ao cliente ou ao Ragexe e permitido." },
    { "n": 17, "text": "Nenhum acesso a VPS e permitido." },
    { "n": 18, "text": "A saida do parser deve ser preservada somente como JSON sanitizado, quando produzida." },
    { "n": 19, "text": "O binario temporario deve ser removido em qualquer desfecho (PASS, FAIL ou STOPPED)." },
    { "n": 20, "text": "O GATE 4 permanece nao autorizado." },
    { "n": 21, "text": "Uma segunda repeticao permanece nao autorizada." },
    { "n": 22, "text": "O PR #52 permanece draft e nao integrado." }
  ],
  "authorizations": {
    "human_decision_required": true,
    "human_decision_received": true,
    "gate_selected": true,
    "gate_3_corrective_repeat_authorized": true,
    "temporary_materialization_authorized": true,
    "local_hashing_authorized": true,
    "static_identity_inspection_authorized": true,
    "authenticode_inspection_authorized": true,
    "gate_4_authorized": false,
    "execution_authorized": false,
    "dynamic_analysis_authorized": false,
    "external_reputation_upload_authorized": false,
    "network_validation_authorized": false,
    "sandbox_creation_authorized": false,
    "client_copy_provision_authorized": false,
    "client_modification_authorized": false,
    "patch_review_authorized": false,
    "patch_application_authorized": false,
    "client_preparation_authorized": false,
    "test_account_authorized": false,
    "first_login_authorized": false,
    "vps_access_authorized": false,
    "distribution_authorized": false,
    "second_repeat_authorized": false
  },
  "execution_state": "AUTHORIZED_NOT_STARTED",
  "rollback": "Antes da materializacao, remover somente este registro se ainda nao publicado ou corrigir por commit adicional. Durante a execucao, interromper, remover o arquivo e o diretorio temporarios e registrar STOPPED ou COMPLETED_FAIL. Apos a execucao, preservar a evidencia real e corrigir documentos por novo commit, sem sobrescrever a evidencia historica invalidada e sem segunda repeticao. Nunca usar reset --hard, git clean ou force push.",
  "notes": "Autorizacao presa ao head bebe4fe e aos blobs do parser/testes. Nenhuma autorizacao transitiva concedida; GATE 4 e segunda repeticao permanecem proibidos; PR #52 permanece draft e nao integrado."
}
